{
  "$schema": "https://json-schema.org/draft/2020-12/schema",
  "$id": "https://sns-s-s.local/schemas/loop-run.schema.json",
  "title": "SNS immutable loop run receipt",
  "type": "object",
  "additionalProperties": false,
  "required": [
    "schema", "run_id", "loop_id", "contract_version", "trigger",
    "trigger_time", "source_commit", "state_hash", "quest_context",
    "pr_context", "consumed_ids", "artifacts", "checks", "belief_effects",
    "terminal_state", "next_action", "created_at"
  ],
  "properties": {
    "schema": {"const": "sns.loop-run.v1"},
    "run_id": {"type": "string", "pattern": "^RUN-[0-9]{8}T[0-9]{12}Z-[a-z0-9-]+-[0-9a-f]{20}$"},
    "loop_id": {"enum": ["daily-governance-triage", "daily-research-operator", "weekly-evidence-synthesis", "monthly-governance", "system-audit"]},
    "contract_version": {"type": "string", "pattern": "^[0-9]+\\.[0-9]+\\.[0-9]+$"},
    "trigger": {"enum": ["scheduled", "explicit-human", "replay"]},
    "trigger_time": {"type": "string", "format": "date-time"},
    "source_commit": {"type": "string", "pattern": "^[0-9a-f]{40}$"},
    "state_hash": {"type": "string", "pattern": "^sha256:[0-9a-f]{64}$"},
    "quest_context": {"type": "object"},
    "pr_context": {"type": "object"},
    "consumed_ids": {"type": "array", "items": {"type": "string"}, "uniqueItems": true},
    "artifacts": {"type": "array", "items": {"type": ["string", "object"]}},
    "checks": {
      "type": "array",
      "items": {
        "type": "object",
        "additionalProperties": false,
        "required": ["name", "status", "evidence"],
        "properties": {
          "name": {"type": "string", "minLength": 1},
          "status": {"enum": ["passed", "failed", "not_run"]},
          "evidence": {"type": "string"}
        }
      }
    },
    "belief_effects": {"type": "array", "items": {"type": "string"}, "uniqueItems": true},
    "terminal_state": {
      "enum": [
        "DONE", "DONE_WITH_LIMITATIONS", "BLOCKED_ENVIRONMENT",
        "BLOCKED_MISSING_EVIDENCE", "BLOCKED_CONFLICT", "VERIFICATION_FAILED",
        "NEEDS_SCIENTIFIC_DECISION", "NEEDS_GOVERNANCE_REVIEW", "NEEDS_APPROVAL"
      ]
    },
    "next_action": {"type": "string", "minLength": 1},
    "created_at": {"type": "string", "format": "date-time"},
    "correction_of": {"type": "string", "pattern": "^RUN-"},
    "platform_prompt_revision": {"type": "string"}
  }
}
