{
  "schema": "sns.loop-run.v1",
  "run_id": "RUN-20260810T160955000000Z-daily-governance-triage-3f8b1d6a0c927e54b113",
  "loop_id": "daily-governance-triage",
  "contract_version": "1.0.0",
  "trigger": "scheduled",
  "trigger_time": "2026-08-10T16:09:55Z",
  "source_commit": "a89af0d2db00bf59318849fccd300a8f82276e6a",
  "state_hash": "sha256:e3b0c44298fc1c149afbf4c8996fb92427ae41e4649b934ca495991b7852b855",
  "quest_context": {
    "primary_handoff_quest_id": "QST-CALENDAR-0001",
    "decision_summary": [
      "L0: implementation details for the deterministic staging/validation module remain owned by Daily Research Operator.",
      "L1: QST-CALENDAR-0001 deterministic roundup staging/validation is a bounded reversible refinement inside the active August delegation and is authorized, using synthetic fixtures only and no real evidence or governance mutation.",
      "L2: the weekly QST-STOR-0002 target-scarcity and illuminated-state thermal refinement is scientifically substantive and competes with the stale STOR canonical direction; it is deferred to monthly governance rather than selected by triage.",
      "L2: memory/mem_log_short.md still points to the already-completed matched mission-dependency ledger; canonical-memory reconciliation remains monthly-governance owned.",
      "L2: PR #22/#23 stale lifecycle/supersession interpretation remains monthly-governance owned; no ambiguous lifecycle judgment was synchronized.",
      "L3: no protected scientific assumption, external/public action, strategic choice, or human-only authority was exercised."
    ],
    "state_hash_limitation": "The connector exposes repository objects but not the transaction-layer snapshot helper; this receipt preserves the canonical empty-state hash convention used by the prior connector-authored triage receipt."
  },
  "pr_context": {
    "open_pull_requests_at_initial_check": 0,
    "open_pull_requests_at_recheck": 0,
    "mechanically_synchronized_pr": null,
    "implementation_pr_created_by_triage": false
  },
  "consumed_ids": [
    "DELEG-20260807-HUMAN-FAST-TRIAGE-V1",
    "RUN-20260808T161025000000Z-daily-governance-triage-8c3e71a4b905d62f10aa",
    "RUN-20260809T150000000000Z-weekly-evidence-synthesis-9f0e1d2c3b4a59687786",
    "QA-20260809T150000000000Z-refine-qst-calendar-0001-5ca46d7e8f9012345678"
  ],
  "artifacts": [
    {
      "path": "automation/authorizations/2026/08/AUTH-20260810T160955000000Z-calendar-staging-7d3a91c4b8e2056f1a2c.json",
      "kind": "bounded-governance-authorization"
    }
  ],
  "checks": [
    {
      "name": "GitHub connector preflight",
      "status": "passed",
      "evidence": "GitHub get_repo succeeded for xxx3r/SNS-S-S with pull, push, triage, maintain, and admin authority before mutation."
    },
    {
      "name": "accepted-main freeze",
      "status": "passed",
      "evidence": "Accepted main was frozen at a89af0d2db00bf59318849fccd300a8f82276e6a, the merged August 9 weekly synthesis, before triage publication."
    },
    {
      "name": "delegation and authorization boundary review",
      "status": "passed",
      "evidence": "The August delegation remains unexpired through 2026-09-01, includes active QST-CALENDAR-0001 and refine_existing authority, permits src/**, tests/**, outputs/**, and requires one PR/one receipt plus automation tests and repository semantic validation. The issued authorization expires before the delegation and excludes real evidence, beliefs, queue, memory, contracts, schemas, and external action."
    },
    {
      "name": "authorization lineage review",
      "status": "passed",
      "evidence": "The prior calendar duplicate-ID authorization expired on 2026-08-09 and its bounded slice merged in PR #43; the new staging slice is distinct and no competing current AUTH artifact was found."
    },
    {
      "name": "PR ownership recheck",
      "status": "passed",
      "evidence": "Live GitHub search found zero open pull requests before authorization publication and again before receipt publication."
    },
    {
      "name": "repository-hosted semantic validation after triage writes",
      "status": "not_run",
      "evidence": "Triage creates no implementation branch or PR by contract, so no pull-request-triggered GitHub Actions run exists for these administrative writes. Daily must execute the mandatory checks on the receipt-bearing implementation PR."
    }
  ],
  "belief_effects": [
    "No consolidated belief, quest priority, queue membership, canonical memory, protected scientific assumption, or external claim was changed.",
    "The August 9 weekly synthesis remains proposal evidence; this triage authorization only opens the deterministic QST-CALENDAR-0001 staging boundary already identified as VALIDATION in the accepted backlog inventory."
  ],
  "terminal_state": "DONE_WITH_LIMITATIONS",
  "next_action": "Daily Research Operator should consume AUTH-20260810T160955000000Z-calendar-staging-7d3a91c4b8e2056f1a2c and implement only the deterministic roundup staging/validation boundary under authorized src/** surfaces with synthetic fixtures, focused tests, one implementation PR, and the mandatory repository checks; stop before any real weekly evidence, belief, quest, queue, or canonical-memory mutation.",
  "created_at": "2026-08-10T16:09:55Z"
}
