{
  "schema": "sns.loop-run.v1",
  "run_id": "RUN-20260812T162018000000Z-daily-governance-triage-4d7a91c2e5b8063f1a20",
  "loop_id": "daily-governance-triage",
  "contract_version": "1.0.0",
  "trigger": "scheduled",
  "trigger_time": "2026-08-12T16:20:18Z",
  "source_commit": "2e36b7cc586770bef991f8ff0f3b2c96bda9c931",
  "state_hash": "sha256:e3b0c44298fc1c149afbf4c8996fb92427ae41e4649b934ca495991b7852b855",
  "quest_context": {
    "primary_handoff_quest_id": "QST-SIM-0002",
    "decision_summary": [
      "L0: implementation details for a stale-coverage time-window metric remain owned by Daily Research Operator.",
      "L1: QST-SIM-0002 explicitly lists stale-coverage time windows as remaining method; adding the smallest deterministic metric to the existing AsteroidWorld coverage baseline is a bounded reversible refinement inside the August delegation and is authorized.",
      "L2: QST-CALENDAR-0001's remaining declared CLI requires scripts/**, which is outside the delegation; real roundup processing, belief append, and governance effects also remain outside fast-governance authority.",
      "L2: QST-SIM-0002 policy comparison, irregular-rotation/shadow-model choices, and interpretation of swarm advantage remain scientific route decisions and are not authorized by this slice.",
      "L2: memory/mem_log_short.md still points to the already-completed STOR matched mission-dependency ledger; canonical-memory reconciliation remains monthly-governance owned.",
      "L2: substantive STOR, PV, META, ARCI, FUND, and other SIM route selection remains outside fast-governance authority.",
      "L3: no protected scientific assumption, external/public action, strategic choice, or human-only authority was exercised."
    ],
    "state_hash_limitation": "The connector exposes repository objects but not the transaction-layer snapshot helper; this receipt preserves the canonical empty-state hash convention used by prior connector-authored triage receipts."
  },
  "pr_context": {
    "open_pull_requests_at_initial_check": 0,
    "open_pull_requests_at_recheck": 0,
    "mechanically_synchronized_pr": null,
    "implementation_pr_created_by_triage": false
  },
  "consumed_ids": [
    "DELEG-20260807-HUMAN-FAST-TRIAGE-V1",
    "RUN-20260811T160132000000Z-daily-governance-triage-91b6e3c8d4a7052f1c20",
    "RUN-20260811T200200000000Z-daily-research-operator-5a7c1e9d3b8064f2a011"
  ],
  "artifacts": [
    {
      "path": "automation/authorizations/2026/08/AUTH-20260812T162018000000Z-sim-stale-coverage-5c8e2a91d7b4063f1a20.json",
      "kind": "bounded-governance-authorization"
    }
  ],
  "checks": [
    {
      "name": "GitHub connector preflight",
      "status": "passed",
      "evidence": "Live GitHub commit read succeeded for xxx3r/SNS-S-S before any mutation; accepted main was accessible through the required connector."
    },
    {
      "name": "accepted-main freeze",
      "status": "passed",
      "evidence": "Accepted main was frozen at 2e36b7cc586770bef991f8ff0f3b2c96bda9c931, merged PR #46, before triage publication."
    },
    {
      "name": "delegation and authorization boundary review",
      "status": "passed",
      "evidence": "The August delegation is unexpired through 2026-09-01, includes active QST-SIM-0002 and refine_existing authority, permits src/**, experiments/**, configs/**, tests/**, outputs/**, and forbids governance/memory/queue surfaces. This authorization narrows writes to src/**, tests/**, and outputs/** and expires within one day."
    },
    {
      "name": "authorization lineage review",
      "status": "passed",
      "evidence": "The three earlier CALENDAR authorizations are represented in accepted lineage and their Daily slices are complete; no competing SIM stale-coverage authorization was found before publication."
    },
    {
      "name": "Issue #38 guard",
      "status": "passed",
      "evidence": "Issue #38 remains open. This run did not reopen or duplicate PRs #35-#37 or the completed STOR mission-dependency ledger."
    },
    {
      "name": "PR ownership recheck",
      "status": "passed",
      "evidence": "Live GitHub search found zero open pull requests before authorization publication and again after the authorization commit."
    },
    {
      "name": "repository-hosted semantic validation after triage writes",
      "status": "not_run",
      "evidence": "Triage creates no implementation branch or PR by contract, so no PR-triggered GitHub Actions surface exists for these administrative writes. Daily must run the mandatory checks on the receipt-bearing implementation PR."
    }
  ],
  "belief_effects": [
    "No consolidated belief, quest priority, queue membership, canonical memory, protected scientific assumption, or external claim was changed.",
    "The authorization moves from three completed deterministic CALENDAR cleanup slices to one bounded SIM measurement primitive without selecting a policy or asserting a scientific advantage."
  ],
  "terminal_state": "DONE_WITH_LIMITATIONS",
  "next_action": "Daily Research Operator should consume AUTH-20260812T162018000000Z-sim-stale-coverage-5c8e2a91d7b4063f1a20 and implement the smallest deterministic stale-coverage time-window metric on the existing QST-SIM-0002 AsteroidWorld coverage baseline with focused synthetic tests and one implementation PR; stop before policy comparison, irregular-rotation/shadow assumptions, beliefs, quest/queue mutation, canonical memory, or external claims.",
  "created_at": "2026-08-12T16:20:18Z"
}
