{
  "schema": "sns.loop-run.v1",
  "run_id": "RUN-20260822T164939000000Z-daily-governance-triage-eaf81c5f6db49327a546",
  "loop_id": "daily-governance-triage",
  "contract_version": "1.0.0",
  "trigger": "scheduled",
  "trigger_time": "2026-08-22T16:49:39Z",
  "source_commit": "4a054a42994fc7d384067088bab180d90287ec91",
  "state_hash": "sha256:e3b0c44298fc1c149afbf4c8996fb92427ae41e4649b934ca495991b7852b855",
  "quest_context": {
    "primary_quest_id": "QST-STOR-0002",
    "accepted_main": "4a054a42994fc7d384067088bab180d90287ec91",
    "delegation_id": "DELEG-20260807-HUMAN-FAST-TRIAGE-V1",
    "candidate_dispositions": [
      {
        "candidate": "PR #50 Weekly correction receipt missing state_hash",
        "level": "L0",
        "disposition": "OWNER_REPAIR_REQUIRED",
        "reason": "PR #50 remains the sole open draft owner. Tests and baseline-artifacts are green while automation-transaction remains failed; the still-unmerged Weekly correction receipt visibly lacks schema-required state_hash. Repair belongs to the Weekly owner, not triage."
      },
      {
        "candidate": "Accepted QST-STOR-0002 fast-rotator surface falsification and architecture disposition",
        "level": "L2",
        "disposition": "DEFER_MONTHLY",
        "reason": "The pending Weekly quest-action proposes block/escalation after FALSIFIED_ON_DECLARED_GRID. Choosing retirement, hosted/larger-geometry redirection, or assumption-changing science is a major architecture and canonical-direction decision reserved to Monthly Governance."
      },
      {
        "candidate": "Fresh substantive Daily authorization on another active quest",
        "level": "L2",
        "disposition": "NO_AUTHORIZATION",
        "reason": "Opening another substantive lane while the unresolved P0 STOR architecture fork remains the canonical blocker would implicitly reprioritize the queue, outside fast-governance authority."
      },
      {
        "candidate": "Local reversible implementation detail inside a future authorized slice",
        "level": "L0",
        "disposition": "DAILY_OWNED",
        "reason": "Such details remain Daily-owned after fresh bounded authority exists."
      },
      {
        "candidate": "Protected scientific assumptions, external/public actions, or strategic commitments",
        "level": "L3",
        "disposition": "DEFER_HUMAN_IF_ENCOUNTERED",
        "reason": "These remain reserved human authority."
      }
    ],
    "issue_38_guard": "Issue #38 remains open. PRs #35-#37 are completed accepted history and were not repeated, reopened, or reauthorized.",
    "memory_status": "memory/mem_log_short.md remains stale, still naming the completed matched mission-dependency ledger as next move; canonical memory is Monthly-owned and was not edited.",
    "drive_status": "No pending decision depended on a clearly relevant SNS Drive artifact; no Drive read was needed."
  },
  "pr_context": {
    "open_prs_at_preflight": [50],
    "open_prs_at_recheck": [50],
    "lifecycle_synchronizations": [],
    "pr_50": {
      "state": "open_draft",
      "head": "7fbc3a4ddff03f4b5cc78702e2428704f5cb0ca9",
      "mergeable": true,
      "review_threads": 0,
      "tests": "passed",
      "baseline_artifacts": "passed",
      "automation_transaction": "failed_semantic_validation"
    }
  },
  "consumed_ids": [],
  "artifacts": [],
  "checks": [
    {
      "name": "GitHub connector preflight",
      "status": "passed",
      "evidence": "GitHub get_repo succeeded for xxx3r/SNS-S-S with admin, maintain, push, pull, and triage authority."
    },
    {
      "name": "accepted main freeze and publication recheck",
      "status": "passed",
      "evidence": "Accepted main was 4a054a42994fc7d384067088bab180d90287ec91 at freeze and remained exact immediately before publication."
    },
    {
      "name": "delegation validity",
      "status": "passed",
      "evidence": "DELEG-20260807-HUMAN-FAST-TRIAGE-V1 remains valid through 2026-09-01T14:00:00Z and does not grant architecture, queue-priority, belief, or canonical-memory authority."
    },
    {
      "name": "authorization lineage",
      "status": "passed",
      "evidence": "Existing August authorization lineage remains historical, consumed, or expired; no current unconsumed authorization owns a new executable slice."
    },
    {
      "name": "PR #50 live checks",
      "status": "failed",
      "evidence": "PR #50 head 7fbc3a4ddff03f4b5cc78702e2428704f5cb0ca9 remains open draft and mergeable; tests run 31982585477 and baseline-artifacts run 31982585495 succeeded, while automation-transaction run 31982585540 failed. The Weekly correction receipt on the branch lacks schema-required state_hash."
    },
    {
      "name": "Issue #38 duplicate-work guard",
      "status": "passed",
      "evidence": "Issue #38 remains open and no completed PR #35-#37 slice was duplicated."
    },
    {
      "name": "Google Drive relevance check",
      "status": "passed",
      "evidence": "No pending classification required a clearly relevant SNS Drive artifact, so no Drive read was needed."
    }
  ],
  "belief_effects": [
    "No scientific belief, quest priority, queue membership, canonical memory, architecture selection, protected assumption, or external claim changed.",
    "No research authorization was issued because PR #50 retains an owner-local schema defect and the accepted STOR falsification still requires Monthly Governance disposition."
  ],
  "terminal_state": "NEEDS_GOVERNANCE_REVIEW",
  "next_action": "Weekly must add schema-required state_hash to PR #50's still-unmerged correction receipt and obtain green semantic validation; Monthly Governance must then disposition the accepted QST-STOR-0002 falsification before Pre-Game issues a fresh substantive Daily authorization.",
  "created_at": "2026-08-22T16:49:39Z"
}