{
  "schema": "sns.loop-run.v1",
  "run_id": "RUN-20260723T061500000000Z-daily-research-operator-4d5a7b9c1e203f6482aa",
  "loop_id": "daily-research-operator",
  "contract_version": "1.0.0",
  "trigger": "explicit-human",
  "trigger_time": "2026-07-23T06:11:00Z",
  "source_commit": "ff4ed80c49321880e0a3fa6c60fbfa6fe0e0776b",
  "state_hash": "sha256:9f7804d99b8f4fffc4e265ec184b6538b851c2595a793ecec02f76d9e32c3661",
  "quest_context": {
    "issue": 30,
    "quest_id": "QST-SYNTH-0001",
    "quest_state": "inactive",
    "acceptance_slice": "register imported synthetic-world capability for conditional discovery and monthly disposition"
  },
  "pr_context": {
    "pr_number": 32,
    "head_commit": "e07d639472d53e22af6ae129b87b11920fceea50",
    "state": "merge_ready"
  },
  "consumed_ids": [
    "RUN-20260723T010700000000Z-daily-research-operator-a41da1fd2cb1cb2cf5b2"
  ],
  "artifacts": [
    {
      "path": "docs/system/research_instrument_registry.md",
      "kind": "instrument_registry"
    },
    {
      "path": "quests/actions/2026/07/qa_20260723_synthetic_worlds_capability.json",
      "kind": "quest_action_proposal"
    },
    {
      "path": "AGENTS.md",
      "kind": "conditional_discovery_pointer"
    }
  ],
  "checks": [
    {
      "name": "tests",
      "status": "passed",
      "evidence": "GitHub Actions tests run 29984385986 completed successfully on PR #32 head e07d639472d53e22af6ae129b87b11920fceea50."
    },
    {
      "name": "baseline artifacts",
      "status": "passed",
      "evidence": "GitHub Actions baseline-artifacts run 29984386004 completed successfully on the same head."
    },
    {
      "name": "automation transaction",
      "status": "passed",
      "evidence": "GitHub Actions automation-transaction run 29984385984 passed automation tests, repository semantic validation, and the full pytest suite."
    },
    {
      "name": "governance boundary",
      "status": "passed",
      "evidence": "QST-SYNTH-0001 remains inactive; the new quest-action record has proposal authority only and asks monthly governance to activate, attach, or defer."
    }
  ],
  "belief_effects": [],
  "terminal_state": "DONE_WITH_LIMITATIONS",
  "next_action": "Merge PR #32, then require monthly governance to accept, reject, or defer the synthetic-world quest-action proposal.",
  "created_at": "2026-07-23T06:15:00Z"
}
