{
  "schema": "sns.loop-run.v1",
  "run_id": "RUN-20260827T163736000000Z-daily-governance-triage-5b8d02f3c916e74a213b",
  "loop_id": "daily-governance-triage",
  "contract_version": "1.1.0",
  "trigger": "scheduled",
  "trigger_time": "2026-08-27T16:37:36Z",
  "source_commit": "b5bd0790db06c49aa376ecd51f4691eeb4d65844",
  "state_hash": "sha256:e3b0c44298fc1c149afbf4c8996fb92427ae41e4649b934ca495991b7852b855",
  "quest_context": {
    "selected_quest_id": "QST-META-0001",
    "selected_level": "L1",
    "selected_blocker_scope": "local",
    "acceptance_slice": "One bounded pure-Python beam-link loss abstraction over steering angle and pointing error with one synthetic parameter set, one deterministic sweep artifact, and focused tests; no physical power-beam claim.",
    "routing": [
      {
        "quest_id": "QST-STOR-0002",
        "decision_level": "L2",
        "blocker_scope": "local",
        "disposition": "Accepted fast-rotator surface route remains locally falsified and architecture replacement remains Monthly/Human territory; removed from this slot without freezing independent quests."
      },
      {
        "quest_id": "QST-ARCI-0001",
        "decision_level": "L2",
        "blocker_scope": "local",
        "disposition": "The Monthly-enacted synthetic-target sensitivity acceptance slice is complete in merged PR #54. Executing its recommended surface-operations evidence measurement would extend beyond the accepted quest's now-completed declared method and requires fresh governance/evidence scope; do not repeat or silently extend it."
      },
      {
        "quest_id": "QST-CALENDAR-0001",
        "decision_level": "L1",
        "blocker_scope": "local",
        "disposition": "Remaining deterministic CLI work requires scripts/**, outside the August delegation's authorized implementation surfaces; belief-ledger and real-roundup steps also cross governance/evidence ownership. No authorization."
      },
      {
        "quest_id": "QST-FUND-0001",
        "decision_level": "L1",
        "blocker_scope": "local",
        "disposition": "Declared artifact is under docs/public/**, outside the August delegation implementation surfaces. External publication remains L3 if reached. No authorization."
      },
      {
        "quest_id": "QST-META-0001",
        "decision_level": "L1",
        "blocker_scope": "local",
        "disposition": "Active P1, delegated, owner-conflict-free, and contains a bounded executable compact loss-model slice wholly within src/**, tests/**, and outputs/**. Authorized without changing queue priority or scientific claims."
      },
      {
        "candidate": "META local fixture, coding, and test details",
        "decision_level": "L0",
        "blocker_scope": "local",
        "disposition": "Leave reversible implementation details to Daily inside the authorization."
      },
      {
        "candidate": "Protected physical assumptions, hardware-readiness claims, external/public actions, or strategic architecture commitments",
        "decision_level": "L3",
        "blocker_scope": "protected",
        "disposition": "Not required by the selected slice; explicit stop conditions preserve the human boundary."
      }
    ],
    "delegation_id": "DELEG-20260807-HUMAN-FAST-TRIAGE-V1",
    "issue_38_guard": "Issue #38 remains open; PRs #35-#37 are completed history and were not repeated or reopened."
  },
  "pr_context": {
    "open_pull_requests_before_authorization": [],
    "open_pull_requests_before_receipt": [],
    "implementation_owner": null,
    "lifecycle_synchronizations": [],
    "note": "PR #54 is merged and its terminal lifecycle synchronization is already accepted on main. No live implementation owner or unambiguous lifecycle debris remained."
  },
  "consumed_ids": [
    "DELEG-20260807-HUMAN-FAST-TRIAGE-V1"
  ],
  "artifacts": [
    "automation/authorizations/2026/08/AUTH-20260827T163736000000Z-meta-beam-loss-4a7c91e2b805d63f102a.json"
  ],
  "checks": [
    {
      "name": "GitHub connector preflight",
      "status": "passed",
      "evidence": "GitHub get_repo succeeded for xxx3r/SNS-S-S with admin, maintain, pull, push, and triage permissions."
    },
    {
      "name": "accepted source freeze and routing-input recheck",
      "status": "passed",
      "evidence": "Accepted source was frozen at b5bd0790db06c49aa376ecd51f4691eeb4d65844. No open PR existed before authorization or before receipt publication; immediately before receipt publication main contained only the new immutable authorization commit a3b314064810dc1888f5dce2f062a14b73f9d8f5."
    },
    {
      "name": "delegation validity",
      "status": "passed",
      "evidence": "DELEG-20260807-HUMAN-FAST-TRIAGE-V1 remains valid through 2026-09-01T14:00:00Z, includes QST-META-0001/refine_existing, permits src/**, tests/**, outputs/**, and requires automation tests plus semantic repository validation."
    },
    {
      "name": "authorization uniqueness and ownership",
      "status": "passed",
      "evidence": "The August authorization lineage was inspected, no live META implementation owner existed, the new AUTH file was created with exclusive-create semantics, and prior authorization history remains visible."
    },
    {
      "name": "routing law",
      "status": "passed",
      "evidence": "The completed ARCI slice was not repeated; local STOR, ARCI-extension, CALENDAR-surface, and FUND-surface stops were recorded and routing continued to the first observed delegated executable P1 slice, QST-META-0001, without changing queue membership or priority."
    },
    {
      "name": "Google Drive dependency",
      "status": "not_run",
      "evidence": "No pending classification depended on a clearly relevant SNS Drive artifact; no Drive read was needed."
    },
    {
      "name": "triage hosted validation",
      "status": "not_run",
      "evidence": "This direct administrative authorization/receipt transaction creates no implementation PR. Daily must run the delegation-mandated checks on its receipt-bearing implementation owner."
    }
  ],
  "belief_effects": [],
  "terminal_state": "DONE_WITH_LIMITATIONS",
  "next_action": "Daily Research Operator should consume AUTH-20260827T163736000000Z-meta-beam-loss-4a7c91e2b805d63f102a and immediately implement the smallest inspectable QST-META-0001 steering-angle/pointing-error loss abstraction with one synthetic parameter set, one deterministic sweep JSON, one focused test file, one implementation PR, one immutable Daily receipt, and the mandatory evaluator; stop before architecture expansion, external evidence, or physical power-beam claims.",
  "created_at": "2026-08-27T16:37:36Z"
}
