{
  "schema": "sns.loop-run.v1",
  "run_id": "RUN-20260815T190132000000Z-daily-research-operator-8f4a91c2e7b6053d102a",
  "loop_id": "daily-research-operator",
  "contract_version": "1.1.0",
  "trigger": "scheduled",
  "trigger_time": "2026-08-15T19:01:32Z",
  "source_commit": "5151a227ce89b4d600d452aa0904342a76f7efbf",
  "state_hash": "sha256:e3b0c44298fc1c149afbf4c8996fb92427ae41e4649b934ca495991b7852b855",
  "quest_context": {
    "quest_id": "QST-STOR-0002",
    "acceptance_slice": "Quantify the hidden cost of the <=30-minute fast-rotator surface constraint and illuminated heat rejection using explicit synthetic screening assumptions, uncertainty, and a falsifier, without selecting between surface and hosted architectures.",
    "authorization_id": "AUTH-20260815T165114000000Z-stor-fast-rotator-constraint-cost-7b3e91c4d8a6052f1c20",
    "measurement_only": true
  },
  "pr_context": {
    "pull_request": 49,
    "branch": "automation/qst-stor-0002-fast-rotator-constraint-cost",
    "implementation_head_before_receipt": "6923ae226881b3198371fb4bbb4cfb52e0f30146",
    "source_main_commit": "5151a227ce89b4d600d452aa0904342a76f7efbf",
    "lifecycle_record_path": "automation/pr_lifecycle/49.json",
    "lifecycle_state_at_receipt": "pending_publication"
  },
  "consumed_ids": [
    "DELEG-20260807-HUMAN-FAST-TRIAGE-V1",
    "AUTH-20260815T165114000000Z-stor-fast-rotator-constraint-cost-7b3e91c4d8a6052f1c20",
    "RUN-20260815T165114000000Z-daily-governance-triage-6a4d91c2e8b7053f102a"
  ],
  "artifacts": [
    {
      "path": "configs/qst_stor_0002_fast_rotator_constraint_cost.json",
      "kind": "bounded synthetic screening configuration"
    },
    {
      "path": "experiments/fast_rotator_constraint_cost.py",
      "kind": "deterministic constraint-cost experiment"
    },
    {
      "path": "outputs/qst_stor_0002/fast_rotator_constraint_cost.json",
      "kind": "versioned target-availability and thermal screening result"
    },
    {
      "path": "tests/test_fast_rotator_constraint_cost.py",
      "kind": "focused exact-reproduction and boundary test"
    }
  ],
  "checks": [
    {
      "name": "GitHub connector preflight",
      "status": "passed",
      "evidence": "Read AGENTS.md, Daily Research Operator v1.1.0, current main, open PRs, Issue #38, current delegation and authorization lineage, state ownership, recent governance receipts, active QST-STOR-0002 slices, accepted outputs, and canonical memory through the connected GitHub provider."
    },
    {
      "name": "authorization validation",
      "status": "passed",
      "evidence": "AUTH-20260815T165114000000Z-stor-fast-rotator-constraint-cost-7b3e91c4d8a6052f1c20 is current through 2026-08-16T16:51:14Z, source-compatible, uniquely owns this slice, permits exactly one config, experiment, test, output, PR, and receipt, and prohibits architecture selection, belief changes, and external sources."
    },
    {
      "name": "Google Drive relevance check",
      "status": "passed",
      "evidence": "A connected Drive search for SNS STOR fast-rotator illuminated thermal package returned no results. No Drive artifact or external evidence was consumed, preserving the zero-external-source budget."
    },
    {
      "name": "implementation and focused reproduction",
      "status": "passed",
      "evidence": "GitHub Actions tests run 31902985439 completed successfully on implementation head 6923ae226881b3198371fb4bbb4cfb52e0f30146, including the focused exact-artifact reproduction and invalid-probability cases."
    },
    {
      "name": "baseline artifacts",
      "status": "passed",
      "evidence": "GitHub Actions baseline-artifacts run 31902985358 completed successfully on implementation head 6923ae226881b3198371fb4bbb4cfb52e0f30146."
    },
    {
      "name": "automation tests",
      "status": "not_run",
      "evidence": "The receipt-bearing head will trigger the repository automation-transaction workflow; its conclusion was not available before this immutable receipt was published."
    },
    {
      "name": "repository semantic validation",
      "status": "not_run",
      "evidence": "The receipt-bearing head will run python -m automation.cli validate-repository; its conclusion was not available before this immutable receipt was published."
    }
  ],
  "belief_effects": [
    "No consolidated belief, quest priority, queue membership, canonical memory, policy preference, protected assumption, or architecture selection changed.",
    "The synthetic sensitivity screen narrows the viable declared grid: target availability at or below one percent exceeds the 100-target budget, while effective emissivity 0.10-0.15 retains at least one simultaneous 15-minute-shadow and illuminated-reference survivor under the declared 20-100 mW loads."
  ],
  "terminal_state": "DONE_WITH_LIMITATIONS",
  "next_action": "Publish the owned PR #49 lifecycle record, require receipt-bearing automation tests and semantic validation plus tests and baseline artifacts to pass on a current review-clear head, then merge this bounded measurement without enacting an architecture choice; route interpretation to Weekly and Monthly governance.",
  "created_at": "2026-08-15T19:12:00Z"
}
