{
  "schema": "sns.loop-run.v1",
  "run_id": "RUN-20260824T161554000000Z-daily-governance-triage-f1b92d6a4c807e35a214",
  "loop_id": "daily-governance-triage",
  "contract_version": "1.0.0",
  "trigger": "scheduled",
  "trigger_time": "2026-08-24T16:15:54Z",
  "source_commit": "b081c0c295da1e8453fb5130474f3100925b4d6c",
  "state_hash": "sha256:e3b0c44298fc1c149afbf4c8996fb92427ae41e4649b934ca495991b7852b855",
  "quest_context": {
    "primary_quest_id": "QST-STOR-0002",
    "accepted_main": "b081c0c295da1e8453fb5130474f3100925b4d6c",
    "delegation_id": "DELEG-20260807-HUMAN-FAST-TRIAGE-V1",
    "candidate_dispositions": [
      {
        "candidate": "PR #51 reconstructed August 23 Weekly synthesis",
        "level": "L2",
        "disposition": "DEFER_MONTHLY",
        "reason": "PR #51 is a green proposal-only Weekly reconstruction that records the accepted STOR falsifier and explicitly asks Monthly Governance to disposition the architecture and work-conserving fallback. Triage may not merge or enact Weekly belief, quest-action, queue, or canonical-direction proposals."
      },
      {
        "candidate": "PR #50 stale August 16 Weekly proposal",
        "level": "L2",
        "disposition": "DEFER_MONTHLY_STALE_WORK",
        "reason": "PR #51 describes PR #50 as stale and reconstructs from accepted main, but supersession or abandonment of an open PR is explicitly Monthly-owned and cannot be guessed by triage."
      },
      {
        "candidate": "QST-ARCI-0001 work-conserving fallback while QST-STOR-0002 is blocked",
        "level": "L2",
        "disposition": "NO_AUTHORIZATION_PENDING_MONTHLY",
        "reason": "QST-ARCI-0001 is already active and delegated, but choosing it as the fallback while the P0 STOR architecture fork is unresolved is a queue-priority/canonical-move decision. PR #51 itself proposes that Monthly make this decision rather than enacting it."
      },
      {
        "candidate": "Local reversible implementation detail inside a future authorized slice",
        "level": "L0",
        "disposition": "DAILY_OWNED",
        "reason": "Such details remain Daily-owned only after a fresh bounded authorization exists."
      },
      {
        "candidate": "Protected scientific assumptions, external/public actions, or strategic commitments",
        "level": "L3",
        "disposition": "DEFER_HUMAN_IF_ENCOUNTERED",
        "reason": "These remain reserved human authority."
      }
    ],
    "issue_38_guard": "Issue #38 remains open. PRs #35-#37 are completed accepted history and were not repeated, reopened, or reauthorized.",
    "memory_status": "memory/mem_log_short.md remains stale, still naming the completed matched mission-dependency ledger as next move; canonical memory is Monthly-owned and was not edited.",
    "drive_status": "No pending decision depended on a clearly relevant SNS Drive artifact; no Drive read was needed."
  },
  "pr_context": {
    "open_prs_at_preflight": [50, 51],
    "open_prs_at_recheck": [50, 51],
    "lifecycle_synchronizations": [],
    "pr_51": {
      "state": "open_draft",
      "head": "f8c9c169c540bb0a809c7da7ad75b31fabafdd09",
      "mergeable": true,
      "review_threads": 0,
      "tests": "passed",
      "baseline_artifacts": "passed",
      "automation_transaction": "passed"
    },
    "pr_50": {
      "state": "open_draft",
      "head": "7fbc3a4ddff03f4b5cc78702e2428704f5cb0ca9",
      "mergeable": true,
      "disposition": "ambiguous_stale_work_requires_monthly"
    }
  },
  "consumed_ids": [],
  "artifacts": [],
  "checks": [
    {
      "name": "GitHub connector preflight",
      "status": "passed",
      "evidence": "GitHub get_repo succeeded for xxx3r/SNS-S-S with admin, maintain, push, pull, and triage authority."
    },
    {
      "name": "accepted main freeze and publication recheck",
      "status": "passed",
      "evidence": "Accepted main was b081c0c295da1e8453fb5130474f3100925b4d6c at freeze and remained exact immediately before publication."
    },
    {
      "name": "delegation validity",
      "status": "passed",
      "evidence": "DELEG-20260807-HUMAN-FAST-TRIAGE-V1 remains valid through 2026-09-01T14:00:00Z and does not grant architecture, queue-priority, belief, or canonical-memory authority."
    },
    {
      "name": "authorization lineage",
      "status": "passed",
      "evidence": "Existing August authorization lineage is historical, consumed, or expired; the latest authorization expired 2026-08-16T16:51:14Z. No current unconsumed authorization owns a new executable slice."
    },
    {
      "name": "PR #51 hosted validation",
      "status": "passed",
      "evidence": "On head f8c9c169c540bb0a809c7da7ad75b31fabafdd09, tests run 32647769156, baseline-artifacts run 32647769034, and automation-transaction run 32647769036 all completed successfully; no review threads are open."
    },
    {
      "name": "Issue #38 duplicate-work guard",
      "status": "passed",
      "evidence": "Issue #38 remains open and no completed PR #35-#37 slice was duplicated."
    },
    {
      "name": "Google Drive relevance check",
      "status": "passed",
      "evidence": "No pending classification required a clearly relevant SNS Drive artifact, so no Drive read was needed."
    }
  ],
  "belief_effects": [
    "No scientific belief, quest priority, queue membership, canonical memory, architecture selection, protected assumption, or external claim changed.",
    "No research authorization was issued because the green Weekly reconstruction places both STOR disposition and the proposed ARCI fallback explicitly at the Monthly Governance boundary."
  ],
  "terminal_state": "NEEDS_GOVERNANCE_REVIEW",
  "next_action": "Monthly Governance should review green draft PR #51, disposition the accepted QST-STOR-0002 falsification, decide whether the already-active QST-ARCI-0001 may serve as a work-conserving fallback, reconcile stale PR #50, and refresh canonical short memory; only then should Pre-Game issue a fresh Daily authorization consistent with that canonical move.",
  "created_at": "2026-08-24T16:15:54Z"
}