{
  "schema": "sns.loop-run.v1",
  "run_id": "RUN-20260719T145804000000Z-weekly-evidence-synthesis-f8e3ccd335c1798175a9",
  "loop_id": "weekly-evidence-synthesis",
  "contract_version": "1.0.0",
  "trigger": "scheduled",
  "trigger_time": "2026-07-19T14:58:04Z",
  "source_commit": "25318716f1778f10a405273b4bd13c1d0b4dc419",
  "state_hash": "sha256:6f9f8c1385a0b0435998dfae9288ae220394f6487b96d3e1a494d635595434f4",
  "quest_context": {
    "quest_id": "QST-STOR-0002",
    "related_quest_ids": ["QST-SIM-0002", "QST-SIM-0003"],
    "question": "What recent evidence materially changes SNS subsystem beliefs or creates bounded testable refinements without displacing QST-STOR-0002?",
    "success_criteria": [
      "Create a dated roundup with machine-readable belief shifts, actions, and awareness update.",
      "Normalize selected primary evidence into immutable evidence events.",
      "Propose belief and quest actions without changing monthly-owned canonical governance.",
      "Keep the active queue unchanged and QST-STOR-0002 canonical."
    ],
    "assumptions_changed": [
      "Power-network evaluation must include starvation and fairness metrics, not aggregate delivery alone.",
      "Swarm persistence should treat topology, role substitution, and passive design as first-class variables.",
      "Thermal-loss candidate evidence should carry environmental degradation margins."
    ],
    "limitations": [
      "The NRL demonstration is terrestrial and does not establish orbital end-to-end performance.",
      "The LEO SBSP result is a simulation preprint and policy-dependent.",
      "The modular robotic swarm operates at a different scale and mechanical regime from 10 mm SNS nodes.",
      "No new combined-stressor PV flight result was identified.",
      "Weekly authority does not update monthly-owned short spawn memory or consolidated belief state."
    ]
  },
  "pr_context": {
    "pr_number": 28,
    "lifecycle_state": "ready_for_review",
    "working_branch": "aurora/weekly-roundup-2026-07-19"
  },
  "consumed_ids": [],
  "artifacts": [
    "calendar/roundups/2026-07-19.md",
    "calendar/evidence/2026/07/ev_20260719_nrl_laser_power.json",
    "calendar/evidence/2026/07/ev_20260719_leo_sbsp_allocation.json",
    "calendar/evidence/2026/07/ev_20260719_swarm_design_reconfiguration.json",
    "calendar/evidence/2026/07/ev_20260719_space_weather_margin.json",
    "calendar/belief_events/2026/07/be_20260719_power_allocation_fairness.json",
    "calendar/belief_events/2026/07/be_20260719_swarm_design_first.json",
    "quests/actions/2026/07/qa_20260719_qst_stor_0002_environmental_margins.json"
  ],
  "checks": [
    {
      "name": "source and governance review",
      "status": "passed",
      "evidence": "Sources were deduplicated; fact, inference, and speculation remain separated; no active quest, canonical move, consolidated belief ledger, ARCI weight, dependency, or automation contract changed."
    },
    {
      "name": "repository semantic validation",
      "status": "passed",
      "evidence": "automation-transaction run 29755004672 passed focused automation tests, `python -m automation.cli validate-repository`, and the full pytest suite against the PR #29 schema authority."
    },
    {
      "name": "GitHub Actions",
      "status": "passed",
      "evidence": "tests run 29755004486, automation-transaction run 29755004672, and baseline-artifacts run 29755002744 completed successfully."
    }
  ],
  "belief_effects": [
    "BEL-20260719T145804000000Z-power-allocation-fairness-005dd594da5755c16eb9",
    "BEL-20260719T145804000000Z-swarm-design-first-70ce9e746bee1b22a31b"
  ],
  "terminal_state": "DONE_WITH_LIMITATIONS",
  "next_action": "Continue QST-STOR-0002 by producing the thermal-loss material/interface evidence checklist with environmental margins; monthly governance may later accept the SIM refinements.",
  "created_at": "2026-07-19T15:19:00Z"
}
